<?xml version="1.0" encoding="UTF-8"?>
<!DOCTYPE visualization SYSTEM "../../visualization.dtd">
<visualization name="Nora" embeddable="true">
    <description>NORA's viewer. A medical image viewer and annotation tool.</description>
    <data_sources>
        <data_source>
            <model_class>HistoryDatasetAssociation</model_class>
            <test test_attr="ext" result_type="datatype">analyze75</test>
            <test test_attr="ext" result_type="datatype">nrrd</test>
            <test test_attr="ext" result_type="datatype">stl</test>
            <test test_attr="ext" result_type="datatype">nii1</test>
            <test test_attr="ext" result_type="datatype">nii1.gz</test>
            <test test_attr="ext" result_type="datatype">nii2</test>
            <test test_attr="ext" result_type="datatype">nii2.gz</test>
            <test test_attr="ext" result_type="datatype">gii</test>
            <test test_attr="ext" result_type="datatype">gii.gz</test>
            <to_param param_attr="id">dataset_id</to_param>
        </data_source>
    </data_sources>
    <params>
        <param type="dataset" var_name_in_template="hda" required="true">dataset_id</param>
    </params>
    <entry_point entry_point_type="chart" src="dist/script.js"/>
</visualization>
