<?xml version="1.0" encoding="UTF-8"?>
<!DOCTYPE visualization SYSTEM "../../visualization.dtd">
<visualization name="HIV-TRACE Viewer">
  <data_sources>
    <data_source>
      <model_class>HistoryDatasetAssociation</model_class>
      <test test_attr="ext" result_type="datatype">hivtrace</test>
      <to_param param_attr="id">dataset_id</to_param>
    </data_source>
  </data_sources>
  <params>
    <param type="dataset" var_name_in_template="hda" required="true">dataset_id</param>
  </params>
  <entry_point entry_point_type="mako">index.mako</entry_point>
</visualization>
