<?xml version="1.0" encoding="UTF-8"?>
<!DOCTYPE visualization SYSTEM "../../visualization.dtd">
<visualization name="Editor" embeddable="true">
    <description>Manually edit text</description>
    <data_sources>
        <data_source>
            <model_class>HistoryDatasetAssociation</model_class>
            <test test_attr="ext">txt</test>
        </data_source>
    </data_sources>
    <params>
        <param required="true">dataset_id</param>
    </params>
    <requirements>
        <requirement type="npm" version="0.0.0" package="@galaxyproject/aceeditor"/>
    </requirements>
    <entry_point entry_point_type="script" src="dist/index.js" css="dist/index.css" />
</visualization>
