<?xml version="1.0" encoding="UTF-8"?>
<!DOCTYPE visualization SYSTEM "../../visualization.dtd">
<visualization name="JupyterLite" embeddable="true">
    <description>Pyodide-based Jupyter Notebooks</description>
    <data_sources>
        <data_source>
            <model_class>HistoryDatasetAssociation</model_class>
            <test test_attr="ext">ipynb</test>
        </data_source>
    </data_sources>
    <params>
        <param required="true">dataset_id</param>
    </params>
    <requirements>
        <requirement type="npm" version="0.0.0" package="@galaxyproject/jupyterlite"/>
    </requirements>
    <entry_point entry_point_type="script" src="dist/index.js" />
</visualization>
